{
  "version": 1,
  "snapshot": "2026-10-08 UTC checkpoint of October7 direction and release",
  "execution": "PAUSED_OWNER_REVIEW_REQUIRED",
  "doc_base": "fa09638d513f46a4075146863aa9fd2865755d69",
  "release": "375d301c345bc47298dd2945a29bf9583c96fbc9",
  "contract_authority": "All Markdown contracts are DRAFT_UNFROZEN;014 separately references a frozen first packet pending successor review. No new executable task or gate is frozen here.",
  "deliverables": [
    {
      "id": "D1",
      "title": "Staff prepares, publishes and admits a fresh event",
      "slices": [
        "STUDIO",
        "ASSETS",
        "TIMING007",
        "INCREMENTS",
        "PUBLICATION008",
        "ADMISSION"
      ]
    },
    {
      "id": "D2",
      "title": "Bidder follows items and returns to own activity",
      "slices": [
        "WATCH012"
      ]
    },
    {
      "id": "D3",
      "title": "Donor records a donation; staff reads/exports for manual processing",
      "slices": [
        "DONATIONS011"
      ]
    },
    {
      "id": "D4",
      "title": "Staff reconciles and presents outcomes",
      "slices": [
        "STAFF_RESULTS",
        "DISPLAY_ACCESS",
        "FINALIZATION"
      ]
    },
    {
      "id": "CROSS",
      "title": "Mobile interaction continuity",
      "slices": [
        "MOBILE014"
      ]
    },
    {
      "id": "RELEASE",
      "title": "Complete connected Saturn delivery",
      "slices": [
        "CONNECTED_RELEASE"
      ]
    }
  ],
  "decisions": {
    "WINDOW_BOUNDS": "May custom group windows extend outside explicit event start/end? Cross-date windows and common event timezone are already accepted.",
    "PUBLICATION_BOUNDS": "Exact initial approval cutoff and eligible active additions/default/custom window bounds; do not revive selected-derived cutoffs or invent closed/past-lot eligibility.",
    "INCREMENT_POLICY": "Exact tier thresholds/inclusive boundaries, amount constraints, any fixed lot override and publication/rule lock.",
    "DONATION_POLICY": "Donation cap and eligibility; any custom-hour policy. Staff on/off independent of auction hours and manual staff processing are already accepted. Unit/minimum/recovery nulls need technical alignment to owner authority.",
    "DISPLAY_POLICY": "Display audience/privacy, visible fields, access issuance/revocation and acceptable TV/projector disclosure; private010 grants do not choose public access.",
    "FINALIZATION_POLICY": "Closed standing only versus an explicit award/finalization operation, authority and language; payment/settlement remains outside scope."
  },
  "slices": [
    {
      "id": "STUDIO",
      "title": "Coherent Studio composition and saved phone preview",
      "file": "studio.md",
      "deliverable": "D1",
      "status": "DRAFT_UNFROZEN",
      "readiness": "BLOCKED_REVIEW",
      "depends_on": [],
      "decisions": [
        "Review compact composition/title-density tradeoff and intended checklist/preview; proposed section names remain provisional."
      ],
      "outcome": "Staff can choose an event, identify/edit its items, see truthful setup actions and inspect the actual saved bidder view in a phone-shaped preview.",
      "exclusions": [
        "No replacement of Studio from the old overlay; no new Live/Overview sections without a distinct purpose decision.",
        "No timing, increment, admission, publication or donation rule changes; no modular page builder."
      ],
      "implementation": [
        "After owner review, selectively port home/editor layout, Save-state grouping and selected-row visibility from9282ba3 to then-accepted released source.",
        "Use the selected event title, readable01 numbering and compact imagery/copy; checklist reflects actual saved/approved/access states and links to real actions. Preserve confirmed versus working draft preview.",
        "Bind actual preview viewport geometry and accessibility, including amount-field error association; retain current control IDs, locks, recovery and connected009/010 behavior."
      ],
      "verification": [
        "Independent observations cover desktop/laptop and narrow saved-preview mode: full titles, reachable routine inputs, selected row, Back/Escape/focus and no overflow.",
        "A held/lost Save preserves locks and exact retry; confirmed saved A agrees with saved API/SQL while working draft remains labeled. Empty/create-error/checklist states are truthful."
      ],
      "acceptance": [
        "Owner reviews actual connected composition and phone preview; independent successor/regression evidence binds exact source.",
        "Demonstrate event\u2192item edit\u2192Save\u2192reload\u2192saved preview, with an actionable checklist; aesthetic proposal evidence alone cannot accept the port."
      ],
      "successor": [
        "Preserve006/006b/006c and their historical bytes. Replace only directly changed presentation expectations through an explicit reviewed requirement delta; amount, focus, saved/working and recovery guarantees remain."
      ],
      "reading": [
        {
          "source": "AGENTS",
          "sections": "Current navigation and durable guardrails; do not execute historical command examples."
        },
        {
          "source": "RELEASE",
          "sections": "Release identity, acceptedSource and hosted evidence limits."
        },
        {
          "source": "DELIVERY",
          "sections": "CompletionRequirements and workflow only; current pause remains authoritative."
        },
        {
          "source": "VISION",
          "sections": "Experience and visual direction; Proposed Studio organization (names provisional)."
        },
        {
          "source": "COMPOSITION",
          "sections": "Review and connected integration; matched composition tradeoffs."
        },
        {
          "source": "WORKSPACE",
          "sections": "Steps3/6/7 and editor retention/Back/Escape/preview/readiness interactions only; all simulated, not authority for timing/admission/money."
        },
        {
          "source": "STUDIO_JS",
          "sections": "Event home, lot editor, Save/retry and preview/checklist rendering."
        },
        {
          "source": "STUDIO_CSS",
          "sections": "Home/editor layout and saved preview geometry."
        },
        {
          "source": "006C",
          "sections": "Scope and checks."
        },
        {
          "source": "006C_MAP",
          "sections": "Staff current-row/preview/focus and compact geometry requirements."
        }
      ]
    },
    {
      "id": "ASSETS",
      "title": "Real item images and integral sponsor assets",
      "file": "assets.md",
      "deliverable": "D1",
      "status": "DRAFT_UNFROZEN",
      "readiness": "BLOCKED_EVIDENCE",
      "depends_on": [],
      "decisions": [
        "Bind storage/access/retention and upload limits in the contract; these technical proposals are not selected by fixture assets."
      ],
      "outcome": "Same-organization staff upload real event/item images and sponsor logos, save them, and see the same assets in saved A and the immutable published catalog.",
      "exclusions": [
        "No AI image generation commitment, universal brand editor, arbitrary remote-image fetching or new service operation during this checkpoint.",
        "No retrospective replacement of published image snapshots."
      ],
      "implementation": [
        "Specify durable opaque asset IDs, organization ownership, validated image content/type/size, alt text, interrupted upload recovery and publish-read permissions before freezing.",
        "Extend the fixed image/logo allowlists deliberately; asset ownership must be server checked and publication snapshots must retain stable referenced bytes.",
        "Choose minimal storage within an explicitly approved host/provider boundary later; freeze write/cleanup semantics and avoid orphan cleanup deleting referenced published assets."
      ],
      "verification": [
        "Real uploaded test files survive Save/reload and render in saved/working/published A; sponsor marks are configured assets, not random fixtures.",
        "Challenge foreign asset IDs, MIME/content mismatches, oversize/corrupt input, failed upload/save, revoked staff and old published-reference retention."
      ],
      "acceptance": [
        "Actual staff upload\u2192saved preview\u2192published browse demonstrates correct assets/alt text and no cross-org access.",
        "Independent durability/access and actual phone/desktop image observations pass on exact candidate; no placeholder fixture can supply acceptance."
      ],
      "successor": [
        "Preserve historical fixed-asset checks. Freeze an explicit schema/allowlist successor while retaining old accepted assets and snapshot/recovery guarantees."
      ],
      "reading": [
        {
          "source": "AGENTS",
          "sections": "Current navigation and durable guardrails; do not execute historical command examples."
        },
        {
          "source": "RELEASE",
          "sections": "Release identity, acceptedSource and hosted evidence limits."
        },
        {
          "source": "DELIVERY",
          "sections": "CompletionRequirements and workflow only; current pause remains authoritative."
        },
        {
          "source": "VISION",
          "sections": "Experience/visual direction: real upload and sponsors."
        },
        {
          "source": "DRAFT",
          "sections": "Image/logo validation and event/lot asset fields."
        },
        {
          "source": "STAFF",
          "sections": "Save allowlist, actor/org scope and immutable lot constraints."
        },
        {
          "source": "CATALOG",
          "sections": "Approved snapshot construction and allowed audience fields."
        },
        {
          "source": "STUDIO_JS",
          "sections": "Current image/sponsor controls and previews."
        }
      ]
    },
    {